title,creator,date,description,subject,location,latitude,longitude,source,identifier,type,format,language,rights,rightsstatement,object_thumb,object_location,reference_url
"Sign of the Calling","Abraham Rutgers Van der Loeff","1935","Detail of the Circus Room Mural by Abraham Rutgers Van der Loeff depicting a man presenting a Masonic hand gesture behind his back and a young man nearby mimicking the sign.","murals (general, decorations on wall);gesture;symbolism (artistic concept)","10 S Post St, Spokane, WA 99201","47.6570422","-117.4240403","Tornado Creek Publications","","Image;StillImage","image/jpeg","eng","","http://rightsstatements.org/vocab/NoC-US/1.0/","http://localhost:4000/make_believe_public/objects/thumbs/make_believe_076_th.jpg","http://localhost:4000/make_believe_public/objects/make_believe_076.jpg",/make_believe_public/items/make_believe_076.html
"Valley View Addition","H.M. Adams","1915","Promotional booster map for an irrigated addition of logged-over farmland outside of Spokane.","promotional materials;real estate;real estate development;irrigation systems;transportation infrastructure","Liberty Lake, WA","47.67465247","-117.1114369","Charles Woodruff Clarke Papers, 1866-1933. Ms 27. Eastern Washington State Historical Society (Northwest Museum of Arts and Culture). Spokane, WA.","","Image;StillImage","image/jpeg","eng","","http://rightsstatements.org/vocab/NoC-US/1.0/","http://localhost:4000/make_believe_public/objects/thumbs/make_believe_077_th.jpg","http://localhost:4000/make_believe_public/objects/make_believe_077.jpg",/make_believe_public/items/make_believe_077.html
"Spokane Commission Dinner","Frank H. Nowell","1909-05","Dinner held in the Education Building during the Alaska Yukon Pacific Exposition in Seattle. E.F. Cartier Van Dissel seated in the foreground at the right.","dinners;fair buildings;industrial expositions","W Stevens Wy NE, Seattle, WA","47.65229487","-122.306686","University of Washington Libraries, Special Collections, [AYP373]. Accessed August 17, 2025. https: //digitalcollections.lib.washington.edu/digital/collection/ayp/id/466.","","Image;StillImage","image/jpeg","eng","","http://rightsstatements.org/vocab/NoC-US/1.0/","http://localhost:4000/make_believe_public/objects/thumbs/make_believe_078_th.jpg","http://localhost:4000/make_believe_public/objects/make_believe_078.jpg",/make_believe_public/items/make_believe_078.html
"Exposition of Apples","National Apple Show, Incorporated","1908-11-28","Letterhead detail from the National Apple Show, noting Elf. Cartier Van Dissel (Phoenix Sawmill and Lumber Company), Henry M. Richards (Washington Water Power Company) and Lois W. Hill (Great Northern Railway) as associates.","letterheads;art exhibitions;advertising;fruit","202 W 2nd Ave, Spokane, WA","47.65527324","-117.4154851","Spokane Flour Mill Records, 1903–1948. Ms 3. Eastern Washington State Historical Society (Northwest Museum of Arts and Culture). Spokane, WA.","","Image;StillImage","image/jpeg","eng","","http://rightsstatements.org/vocab/NoC-US/1.0/","http://localhost:4000/make_believe_public/objects/thumbs/make_believe_079_th.jpg","http://localhost:4000/make_believe_public/objects/make_believe_079.jpg",/make_believe_public/items/make_believe_079.html
"The Arrival in Spokane","William C. Morris","1911-11-23","Cartoon depicting the arrival of the apple caricatures in Spokane in front of the Old Armory Building.","editorial cartoons;cartoons (humorous images);caricatures;fair buildings;flags","202 W 2nd Ave, Spokane, WA","47.65527324","-117.4154851","Adam H. Irving Papers, 1905-1943. MsSC 141. Eastern Washington State Historical Society (Northwest Museum of Arts and Culture). Spokane, WA.","","Image;StillImage","image/jpeg","eng","","http://rightsstatements.org/vocab/NoC-US/1.0/","http://localhost:4000/make_believe_public/objects/thumbs/make_believe_080_th.jpg","http://localhost:4000/make_believe_public/objects/make_believe_080.jpg",/make_believe_public/items/make_believe_080.html
"Termination of Tenancy","Northwestern and Pacific Hypotheekbank","1933-12-05","Notice issued from the bank to the Miller-Dervant costume company.","legal notices;legal documents;real estate;commercial buildings","209-211 Post Street, Spokane, WA","47.65398154","-117.4232802","Miller-Dervant Company Records, 1896-1955. MsSC 198. Eastern Washington State Historical Society (Northwest Museum of Arts and Culture). Spokane, WA.","","Image;StillImage","image/jpeg","eng","","http://rightsstatements.org/vocab/NoC-US/1.0/","http://localhost:4000/make_believe_public/objects/thumbs/make_believe_081_th.jpg","http://localhost:4000/make_believe_public/objects/make_believe_081.jpg",/make_believe_public/items/make_believe_081.html
"Phoenix Lumber Company Float","H.W. Wilkes","1910","Horse-drawn parade float on a dirt road.","parades;horse-drawn vehicles;banners;flags;lumber","Medical Lake, WA","47.57269698","-117.6851006","Medical Lake Heritage Collection, Medical Lake Historical Society, Washington Rural Heritage, https: //washingtonruralheritage.org/cdm/ref/collection/medicallake/id/1 (accessed June 15, 2024).","","Image;StillImage","image/jpeg","eng","","http://rightsstatements.org/vocab/NoC-US/1.0/","http://localhost:4000/make_believe_public/objects/thumbs/make_believe_082_th.jpg","http://localhost:4000/make_believe_public/objects/make_believe_082.jpg",/make_believe_public/items/make_believe_082.html
"A. R. Van der Loeff Show Cards","Abraham Rutgers Van der Loeff","1910-04-19","Letterhead illustration for the commercial artist from an invoice directed to Spokane Flour Mills.","letterheads;commercial art;windmills;invoices","216-298 S Post St., Spokane, WA","47.65391603","-117.4234361","Spokane Flour Mill Records, 1903–1948. Ms 3. Eastern Washington State Historical Society (Northwest Museum of Arts and Culture). Spokane, WA.","","Image;StillImage","image/jpeg","eng","","http://rightsstatements.org/vocab/NoC-US/1.0/","http://localhost:4000/make_believe_public/objects/thumbs/make_believe_083_th.jpg","http://localhost:4000/make_believe_public/objects/make_believe_083.jpg",/make_believe_public/items/make_believe_083.html
"Dutch Colonial Interests","Arbuckle Brothers","1890","Series of illustrations depicting Dutch colonial interests from &lt;em&gt;&lt;em&gt;Arbuckles&#39; Illustrated Atlas of Fifty Principal Nations of The World&lt;/em&lt;/em&gt;.","plates (illustrations);colonialism;maps;plantations;harvesting;sailing vessels","","","","David Rumsey Historical Map Collection","","Image;StillImage","image/jpeg","eng","","http://rightsstatements.org/vocab/NoC-US/1.0/","http://localhost:4000/make_believe_public/objects/thumbs/make_believe_084_th.jpg","http://localhost:4000/make_believe_public/objects/make_believe_084.jpg",/make_believe_public/items/make_believe_084.html
"Born Before the Fire","E.T. Hawk","1910","Two women riding in the back of an automobile in a parade line, flying a banner reading &quot;Native Daughters of Spokane. Born Before the Fire.&quot;","parades;open automobiles;banners;umbrellas;hats;awnings","Spokane, WA","47.65849572","-117.4203818","E.T. Hawk Photograph Collection. SPC-023-0996. Item SPC-023-0996_03_414. Eastern Washington University Archives, John F. Kennedy Memorial Library, Cheney, WA.","","Image;StillImage","image/jpeg","eng","","http://rightsstatements.org/vocab/NoC-US/1.0/","http://localhost:4000/make_believe_public/objects/thumbs/make_believe_085_th.jpg","http://localhost:4000/make_believe_public/objects/make_believe_085.jpg",/make_believe_public/items/make_believe_085.html
"Colville, Washington","","1900","Small, sparsely populated city center of Colville, WA.","cityscapes (representations);main streets;street scenes;horse-drawn vehicles;utility poles;hills (landforms)","Colville, WA","48.54493786","-117.9022105","Spokane Public Library, accessed February 26, 2026, https: //lange.spokanelibrary.org/items/show/4636","","Image;StillImage","image/jpeg","eng","","http://rightsstatements.org/vocab/NoC-US/1.0/","http://localhost:4000/make_believe_public/objects/thumbs/make_believe_086_th.jpg","http://localhost:4000/make_believe_public/objects/make_believe_086.jpg",/make_believe_public/items/make_believe_086.html
"Bound for Wineland","","1895-04-17","Charles Evans as Leif Eriksson in “&lt;em&gt;Bound for Wineland&lt;/em&gt;” parade.","parades;life floats;performance costumes;boats;spectators (event observers)","Tacoma, WA","47.25601169","-122.445065","TPL-4135, Northwest Room, Spokane Public Library.","","Image;StillImage","image/jpeg","eng","","http://rightsstatements.org/vocab/NoC-US/1.0/","http://localhost:4000/make_believe_public/objects/thumbs/make_believe_087_th.jpg","http://localhost:4000/make_believe_public/objects/make_believe_087.jpg",/make_believe_public/items/make_believe_087.html
"Birds Eye View of Spokane","Carl Dahlgren","1880","Illustration of Spokane created in the early 1880s.","illustrations;urban landscapes;valleys (landforms);roads","Spokane, WA","47.65849572","-117.4203818","Eastern Washington State Historical Society. Ephemera Collection. Northwest Museum of Arts and Culture, Spokane, WA.","","Image;StillImage","image/jpeg","eng","","http://rightsstatements.org/vocab/NoC-US/1.0/","http://localhost:4000/make_believe_public/objects/thumbs/make_believe_088_th.jpg","http://localhost:4000/make_believe_public/objects/make_believe_088.jpg",/make_believe_public/items/make_believe_088.html
"Birds Eye View of Spokane, Detail","Carl Dahlgren","1880","Detail of illustration, revealing the artist beside two figures wearing top hats.","figures (illustrations);urban landscapes;top hats (hats);umbrellas;easels;cityscapes (representations)","Spokane, WA","47.65849572","-117.4203818","Eastern Washington State Historical Society. Ephemera Collection. Northwest Museum of Arts and Culture, Spokane, WA.","","Image;StillImage","image/jpeg","eng","","http://rightsstatements.org/vocab/NoC-US/1.0/","http://localhost:4000/make_believe_public/objects/thumbs/make_believe_089_th.jpg","http://localhost:4000/make_believe_public/objects/make_believe_089.jpg",/make_believe_public/items/make_believe_089.html
"Made in Spokane","The 150,000 Club","1908-03-31","Letterhead logo for the 1500, 000 Club from an invoice issued to the Spokane Flour Mills.","logos;letterheads;emblems (symbols);triangles (polygons);typography","Spokane, WA","47.65849572","-117.4203818","Spokane Flour Mill Records, 1903–1948. Ms 3. Eastern Washington State Historical Society (Northwest Museum of Arts and Culture). Spokane, WA.","","Image;StillImage","image/jpeg","eng","","http://rightsstatements.org/vocab/NoC-US/1.0/","http://localhost:4000/make_believe_public/objects/thumbs/make_believe_090_th.jpg","http://localhost:4000/make_believe_public/objects/make_believe_090.jpg",/make_believe_public/items/make_believe_090.html

