title,creator,date,description,subject,location,latitude,longitude,source,identifier,type,format,language,rights,rightsstatement,object_thumb,object_location,reference_url
"Injured Innocence, Detail","Centennial Mill Company","1910","Detail of trade card advertisement for Centennial Mills Company.","trade cards;advertising;wheatstacks;packaging","Spokane, WA","47.65849572","-117.4203818","Eastern Washington State Historical Society. Ephemera Collection. Northwest Museum of Arts and Culture, Spokane, WA.","","Image;StillImage","image/jpeg","eng","","http://rightsstatements.org/vocab/NoC-US/1.0/","http://localhost:4000/make_believe_public/objects/thumbs/make_believe_039_th.jpg","http://localhost:4000/make_believe_public/objects/make_believe_039.jpg",/make_believe_public/items/make_believe_039.html
"Spokane Falls and Her Natural Resources","Northwest Industrial Exposition","1890","Map of the natural resources in and around Spokane for the 1890 Northwest Industrial Exposition.","maps (documents);townscapes (representations);rivers;mining;agriculture (discipline);industry (economic concept)","Spokane, WA","47.65849572","-117.4203818","Eastern Washington State Historical Society. Ephemera Collection. Northwest Museum of Arts and Culture, Spokane, WA.","","Image;StillImage","image/jpeg","eng","","http://rightsstatements.org/vocab/NoC-US/1.0/","http://localhost:4000/make_believe_public/objects/thumbs/make_believe_040_th.jpg","http://localhost:4000/make_believe_public/objects/make_believe_040.jpg",/make_believe_public/items/make_believe_040.html
"Spokane Falls and Her Natural Resources, Detail","Northwest Industrial Exposition","1890","Detail of a map of the natural resources in and around Spokane for the 1890 Northwest Industrial Exposition.","natural resources;industrial expositions;grids (layout features)","Spokane, WA","47.65849572","-117.4203818","Eastern Washington State Historical Society. Ephemera Collection. Northwest Museum of Arts and Culture, Spokane, WA.","","Image;StillImage","image/jpeg","eng","","http://rightsstatements.org/vocab/NoC-US/1.0/","http://localhost:4000/make_believe_public/objects/thumbs/make_believe_041_th.jpg","http://localhost:4000/make_believe_public/objects/make_believe_041.jpg",/make_believe_public/items/make_believe_041.html
"Northern Light, Lodge No. 70","International Order of Good Templars","1905","Ribbon from the organization.","insignia ribbons;banners;processional banners","Spokane, WA","47.65849572","-117.4203818","Sutton Family Papers, ca. 1884- ca. 1910. MsSC 131. Eastern Washington State Historical Society (Northwest Museum of Arts and Culture). Spokane, WA.","","Image;StillImage","image/jpeg","eng","","http://rightsstatements.org/vocab/NoC-US/1.0/","http://localhost:4000/make_believe_public/objects/thumbs/make_believe_042_th.jpg","http://localhost:4000/make_believe_public/objects/make_believe_042.jpg",/make_believe_public/items/make_believe_042.html
"Spokane -- Parades (#07)","Thomas White Tolman","1905-08-25","Procession of Masonic Blue Lodges to new Temple on Riverside Avenue at dedication.","processions;Ionic columns;bicycles;outbuildings","1110 W Riverside Ave, Spokane, WA","47.65849572","-117.4203818","Spokane Public Library, accessed January 24, 2026, https: //lange.spokanelibrary.org/items/show/2810.","","Image;StillImage","image/jpeg","eng","","http://rightsstatements.org/vocab/NoC-US/1.0/","http://localhost:4000/make_believe_public/objects/thumbs/make_believe_043_th.jpg","http://localhost:4000/make_believe_public/objects/make_believe_043.jpg",/make_believe_public/items/make_believe_043.html
"Damon and Pythias Illustration","Knights of Pythias, Western Star Division, No. 7","1894-01-03","Depiction of the characters Damon and Pythias beneath a banner with the letters FCB, standing for friendship, charity and benevolence.","figures (illustrations);banners;armor","Spokane, WA","47.65849572","-117.4203818","Sutton Family Papers, ca. 1884- ca. 1910. MsSC 131. Eastern Washington State Historical Society (Northwest Museum of Arts and Culture). Spokane, WA.","","Image;StillImage","image/jpeg","eng","","http://rightsstatements.org/vocab/NoC-US/1.0/","http://localhost:4000/make_believe_public/objects/thumbs/make_believe_044_th.jpg","http://localhost:4000/make_believe_public/objects/make_believe_044.jpg",/make_believe_public/items/make_believe_044.html
"Charles Woodruff Clarke","The Fraternal Identification Co. of America","1907-08-21","Fraternal Identification Card.","certificates;printed materials (object genre);signatures (names)","Spokane, WA","47.65849572","-117.4203818","Charles Woodruff Clarke Papers, 1866-1933. Ms 27. Eastern Washington State Historical Society (Northwest Museum of Arts and Culture). Spokane, WA.","","Image;StillImage","image/jpeg","eng","","http://rightsstatements.org/vocab/NoC-US/1.0/","http://localhost:4000/make_believe_public/objects/thumbs/make_believe_045_th.jpg","http://localhost:4000/make_believe_public/objects/make_believe_045.jpg",/make_believe_public/items/make_believe_045.html
"Shriner Cecil Walwrath","Richards Photography Studio","1945","Kodachrome stereoscopic images of Shriner Cecil Walwrath in brown face makeup and pseudo-Middle Eastern dress.","stereoscopic photography;Kodachrome (TM);photographs;performance costumes;cultural appropriation","Tacoma, WA","47.25601169","-122.445065","Northwest Room, Spokane Public Library","","Image;StillImage","image/jpeg","eng","","http://rightsstatements.org/vocab/NoC-US/1.0/","http://localhost:4000/make_believe_public/objects/thumbs/make_believe_046_th.jpg","http://localhost:4000/make_believe_public/objects/make_believe_046.gif",/make_believe_public/items/make_believe_046.html
"Sixteen Factories in One","The Henderson-Ames Company","1900","Back cover of the company&#39;s catalogue with illustrations of the facilities from various angles.","marginal illustrations;manufactories;industrial buildings;smokestacks;rail transportation equipment","Kalamazoo, MI","42.29157856","-85.5878968","Eastern Washington University Archives, John F. Kennedy Memorial Library, Cheney, WA.","","Image;StillImage","image/jpeg","eng","","http://rightsstatements.org/vocab/NoC-US/1.0/","http://localhost:4000/make_believe_public/objects/thumbs/make_believe_047_th.jpg","http://localhost:4000/make_believe_public/objects/make_believe_047.jpg",/make_believe_public/items/make_believe_047.html
"Miller-Dervant Business Card","The Miller-Dervant Company","1905","Ornate engraved business card for the Spokane-based costumers and wig designers.","business cards;engraving (action);graphic design;floral patterns;typography;advertising","124 Post Street, Spokane, WA","47.65624296","-117.423533","Miller-Dervant Company Records, 1896-1955. MsSC 198. Eastern Washington State Historical Society (Northwest Museum of Arts and Culture). Spokane, WA.","","Image;StillImage","image/jpeg","eng","","http://rightsstatements.org/vocab/NoC-US/1.0/","http://localhost:4000/make_believe_public/objects/thumbs/make_believe_048_th.jpg","http://localhost:4000/make_believe_public/objects/make_believe_048.jpg",/make_believe_public/items/make_believe_048.html
"Gentleman&#39;s Costumes","The Miller-Dervant Company","1906","Sample of costumes available, including Uncle Sam, Negro Minstrel and Polar Bear.","performance costumes;costumes (character dress);figures (illustrations)","124 Post Street, Spokane, WA","47.65624296","-117.423533","Miller-Dervant Company Records, 1896-1955. MsSC 198. Eastern Washington State Historical Society (Northwest Museum of Arts and Culture). Spokane, WA.","","Image;StillImage","image/jpeg","eng","","http://rightsstatements.org/vocab/NoC-US/1.0/","http://localhost:4000/make_believe_public/objects/thumbs/make_believe_049_th.jpg","http://localhost:4000/make_believe_public/objects/make_believe_049.jpg",/make_believe_public/items/make_believe_049.html
"We Contract to Makeup and Costume Plays","The Miller-Dervant Company","1906","Back cover illustration of the 1906 Miller-Dervant costume catalogue.","costumes (character dress);illustrations;trade catalogs;advertising;costumes (character dress)","124 Post Street, Spokane, WA","47.65624296","-117.423533","Miller-Dervant Company Records, 1896-1955. MsSC 198. Eastern Washington State Historical Society (Northwest Museum of Arts and Culture). Spokane, WA.","","Image;StillImage","image/jpeg","eng","","http://rightsstatements.org/vocab/NoC-US/1.0/","http://localhost:4000/make_believe_public/objects/thumbs/make_believe_050_th.jpg","http://localhost:4000/make_believe_public/objects/make_believe_050.jpg",/make_believe_public/items/make_believe_050.html
"The Dance of the Dutch","E.T. Hawk","1913","Photo that may be documenting an event from the 1913 Spokane Pow Wow, taken from the bleachers of Glover Field, then known as The Stadium, looking out onto the Monroe Bridge and Spokane River.","photographs;parades;spectators (event observers);arch bridges;bleachers;rivers","Glover Field, Spokane, WA","47.65979743","-117.431453","E.T. Hawk Photograph Collection. SPC-023-0996. Item SPC-023-0996_02_266. Eastern Washington University Archives, John F. Kennedy Memorial Library, Cheney, WA.","","Image;StillImage","image/jpeg","eng","","http://rightsstatements.org/vocab/NoC-US/1.0/","http://localhost:4000/make_believe_public/objects/thumbs/make_believe_051_th.jpg","http://localhost:4000/make_believe_public/objects/make_believe_051.jpg",/make_believe_public/items/make_believe_051.html
"The Dance of the Dutch, Detail","E.T. Hawk","1913","Detail of photograph that may be documenting an event from the 1913 Spokane Pow Wow.","photographs;children&#39;s clothing;musical performances;hats;stripes","Glover Field, Spokane, WA","47.65979743","-117.431453","E.T. Hawk Photograph Collection. SPC-023-0996. Item SPC-023-0996_02_266. Eastern Washington University Archives, John F. Kennedy Memorial Library, Cheney, WA.","","Image;StillImage","image/jpeg","eng","","http://rightsstatements.org/vocab/NoC-US/1.0/","http://localhost:4000/make_believe_public/objects/thumbs/make_believe_052_th.jpg","http://localhost:4000/make_believe_public/objects/make_believe_052.jpg",/make_believe_public/items/make_believe_052.html
"Songs as Sung at the Dutch Mill","Coeur d&#39;Alene Hotel","1940","Cover of the song folder for the Dutch Mill.","songbooks;sheet music;musical instruments;accordions;trumpets;guitars","232 N Howard St, Spokane, WA","47.66003752","-117.4208342","Jerome Peltier Archive of Spokane Area History, 1934-2004. MsSC 5753. Eastern Washington State Historical Society (Northwest Museum of Arts and Culture). Spokane, WA.","","Image;StillImage","image/jpeg","eng;de","","http://rightsstatements.org/vocab/NoC-US/1.0/","http://localhost:4000/make_believe_public/objects/thumbs/make_believe_053_th.jpg","http://localhost:4000/make_believe_public/objects/make_believe_053.jpg",/make_believe_public/items/make_believe_053.html
"Business Card","Holland Advertising Company","1910","Business card featuring an illustration of a young woman in pigtails in front of a windmill.","business cards;windmills;advertising;commercial art;typography","717 W Main Avenue, Spokane, WA","47.6590355","-117.4227972","Spokane Flour Mill Records, 1903–1948. Ms 3. Eastern Washington State Historical Society (Northwest Museum of Arts and Culture). Spokane, WA.","","Image;StillImage","image/jpeg","eng","","http://rightsstatements.org/vocab/NoC-US/1.0/","http://localhost:4000/make_believe_public/objects/thumbs/make_believe_054_th.jpg","http://localhost:4000/make_believe_public/objects/make_believe_054.jpg",/make_believe_public/items/make_believe_054.html
"Advertisement","Flyer Flexible","1894-01-03","Advertisement featuring a caricature of a German-American.","advertising;advertising;caricatures","Spokane, WA","47.65849572","-117.4203818","Sutton Family Papers, ca. 1884- ca. 1910. MsSC 131. Eastern Washington State Historical Society (Northwest Museum of Arts and Culture). Spokane, WA.","","Image;StillImage","image/jpeg","eng","","http://rightsstatements.org/vocab/NoC-US/1.0/","http://localhost:4000/make_believe_public/objects/thumbs/make_believe_055_th.jpg","http://localhost:4000/make_believe_public/objects/make_believe_055.jpg",/make_believe_public/items/make_believe_055.html
"SS Great Northern","Kiser Photo Company","1915-03-15","Great Northern Railway steamship on the Columbia River near Flavel, Oregon.","steamships;flags;boats;rivers","Flavel, Oregon (historical)","46.19014109","-123.928846","5.8 × 9.1 in., Org. Lot 78, Box 6, Folder 7, Item 003, Oregon Historical Society Library, Portland, OR.","","Image;StillImage","image/jpeg","eng","","http://rightsstatements.org/vocab/NoC-US/1.0/","http://localhost:4000/make_believe_public/objects/thumbs/make_believe_056_th.jpg","http://localhost:4000/make_believe_public/objects/make_believe_056.jpg",/make_believe_public/items/make_believe_056.html
"Oriental Baths and Laundry","Ryosuke Akashi","1913","Photograph of Spokane storefront.","photographs;storefronts;bathhouses (water recreation structures);laundries (businesses);signage;portraits","Spokane, WA","47.65849572","-117.4203818","Joel E. Ferris Research Archives, Northwest Museum of Arts and Culture (Eastern Washington State Historical Society), Spokane, WA, accessed January 24, 2026, https: //lange.spokanelibrary.org/items/show/5985.","","Image;StillImage","image/jpeg","eng;ja","","http://rightsstatements.org/vocab/NoC-US/1.0/","http://localhost:4000/make_believe_public/objects/thumbs/make_believe_057_th.jpg","http://localhost:4000/make_believe_public/objects/make_believe_057.jpg",/make_believe_public/items/make_believe_057.html
"Spokane Parade Scene","E.T. Hawk","1913","&quot;Chinese themed parade participants on
Riverside Avenue&quot;","parades;street scenes;banners;paper lanterns;spectators (event observers);umbrellas","914 W Riverside Ave, Spokane, WA","47.6581197","-117.4261855","E.T. Hawk Photograph Collection. SPC-023-0996. Item SPC-023-0996_03_407. Eastern Washington University Archives, John F. Kennedy Memorial Library, Cheney, WA.","","Image;StillImage","image/jpeg","eng","","http://rightsstatements.org/vocab/NoC-US/1.0/","http://localhost:4000/make_believe_public/objects/thumbs/make_believe_058_th.jpg","http://localhost:4000/make_believe_public/objects/make_believe_058.jpg",/make_believe_public/items/make_believe_058.html
"Tai Chi Company Flour Sack","Spokane Flour Mills","1910","Spokane Flour Mills wholesale flour design for trade in Chinese markets.","packaging;fabricators;trademarks","","","","Eastern Washington State Historical Society. Artifacts Collection. Northwest Museum of Arts and Culture, Spokane, WA.","","Image;StillImage","image/jpeg","eng","","http://rightsstatements.org/vocab/NoC-US/1.0/","http://localhost:4000/make_believe_public/objects/thumbs/make_believe_059_th.jpg","http://localhost:4000/make_believe_public/objects/make_believe_059.jpg",/make_believe_public/items/make_believe_059.html
"Pato Brand Flour Sack","Spokane Flour Mills","1910","Spokane Flour Mills wholesale flour design for trade in Filipino markets.","packaging;cloth;advertising;advertising","","","","Eastern Washington State Historical Society. Artifacts Collection. Northwest Museum of Arts and Culture, Spokane, WA.","","Image;StillImage","image/jpeg","eng","","http://rightsstatements.org/vocab/NoC-US/1.0/","http://localhost:4000/make_believe_public/objects/thumbs/make_believe_060_th.jpg","http://localhost:4000/make_believe_public/objects/make_believe_060.jpg",/make_believe_public/items/make_believe_060.html
"Orchard Brand Flour Sack","Spokane Flour Mills","1910","Spokane Flour Mills wholesale flour design for trade in Chinese markets.","textiles (visual works);trademarks;Chinese characters (writing system);flowers (plant components)","","","","Eastern Washington State Historical Society. Artifacts Collection. Northwest Museum of Arts and Culture, Spokane, WA.","","Image;StillImage","image/jpeg","eng;zh","","http://rightsstatements.org/vocab/NoC-US/1.0/","http://localhost:4000/make_believe_public/objects/thumbs/make_believe_061_th.jpg","http://localhost:4000/make_believe_public/objects/make_believe_061.jpg",/make_believe_public/items/make_believe_061.html
"Raymond E. Bigelow Leading the Pow Wow","E.T. Hawk","1913","Director of the Spokane Ad Club Raymond E. Bigelow leading the Pow Wow Celebration in brown face make up and Indigenous dress as &quot;Big Chief I&quot;.","parades;celebrations;costumes (character dress);headdresses;street scenes;banners","","","","E.T. Hawk Photograph Collection. SPC-023-0996. Item SPC-023-0996_03_378. Eastern Washington University Archives, John F. Kennedy Memorial Library, Cheney, WA.","","Image;StillImage","image/jpeg","eng","","http://rightsstatements.org/vocab/NoC-US/1.0/","http://localhost:4000/make_believe_public/objects/thumbs/make_believe_062_th.jpg","http://localhost:4000/make_believe_public/objects/make_believe_062.jpg",/make_believe_public/items/make_believe_062.html
"Miss Spokane and Queen Caroline Testout","Spokane Ad Club","1913","Marguerite Motie as Miss Spokane and four year-old Mildred Tucker as Queen Caroline Testout.","postcards;day dresses;roses (flowers);headbands (headgear);sashes (costume accessories)","","","","Postcard Collection, Northwest Room, Spokane Public Library, accessed January 24, 2026, https: //lange.spokanelibrary.org/items/show/5261.","","Image;StillImage","image/jpeg","eng","","http://rightsstatements.org/vocab/NoC-US/1.0/","http://localhost:4000/make_believe_public/objects/thumbs/make_believe_063_th.jpg","http://localhost:4000/make_believe_public/objects/make_believe_063.jpg",/make_believe_public/items/make_believe_063.html
"The American Wonderland","Spokane Chamber of Commerce","1910","Illustration of Marguerite Motie as Miss Spokane above a map of the Pacific Northwest.","illustrations;promotional materials;maps (documents)","","","","Eastern Washington State Historical Society. Ephemera Collection. Northwest Museum of Arts and Culture, Spokane, WA.","","Image;StillImage","image/jpeg","eng","","http://rightsstatements.org/vocab/NoC-US/1.0/","http://localhost:4000/make_believe_public/objects/thumbs/make_believe_064_th.jpg","http://localhost:4000/make_believe_public/objects/make_believe_064.jpg",/make_believe_public/items/make_believe_064.html
"Big Chief I Bids You Be Merry","Spokane Ad Club;Spokane Chamber of Commerce","1913","Introduction to the program, featuring Raymond E. Bigelow, Marguerite Motie as Miss Spokane and Spokane irrigation leader Fm. March.","posters;Native American regalia;headdresses;advertising","Spokane, WA","47.65849572","-117.4203818","Eastern Washington University Archives, John F. Kennedy Memorial Library, Cheney, WA.","","Image;StillImage","image/jpeg","eng","","http://rightsstatements.org/vocab/NoC-US/1.0/","http://localhost:4000/make_believe_public/objects/thumbs/make_believe_065_th.jpg","http://localhost:4000/make_believe_public/objects/make_believe_065.jpg",/make_believe_public/items/make_believe_065.html
"Frontier Recreation Scene in Parade","Charles A. (Charles August) Libby","1936-08","Parade showing wagons, streetcars and buses.","parades;streetcars;buses;cityscapes (representations);awnings","Spokane, WA","47.65849572","-117.4203818","Northwest Room, Spokane Public Library, accessed January 24, 2026, https: //lange.spokanelibrary.org/items/show/2808.","","Image;StillImage","image/jpeg","eng","","http://rightsstatements.org/vocab/NoC-US/1.0/","http://localhost:4000/make_believe_public/objects/thumbs/make_believe_066_th.jpg","http://localhost:4000/make_believe_public/objects/make_believe_066.jpg",/make_believe_public/items/make_believe_066.html
"Lunette Decorations in the Old National Bank","","1908-09","Lunette decorations and interior view of bank building, designed by architect All. Rand.","lunettes (wall components);arches;statues;interior design","422 W Riverside Ave, Spokane, WA","47.65846588","-117.419144","Eastern Washington State Historical Society. Ephemera Collection. Northwest Museum of Arts and Culture, Spokane, WA.","","Image;StillImage","image/jpeg","eng","","http://rightsstatements.org/vocab/NoC-US/1.0/","http://localhost:4000/make_believe_public/objects/thumbs/make_believe_067_th.jpg","http://localhost:4000/make_believe_public/objects/make_believe_067.jpg",/make_believe_public/items/make_believe_067.html
"Lunette Decorations in the Old National Bank, Detail","","1908-09","Lunette decorations and interior view of bank building, designed by architect All. Rand.","lunettes (wall components);arches;murals (general, decorations on wall)","422 W Riverside Ave, Spokane, WA","47.65846588","-117.419144","Eastern Washington State Historical Society. Ephemera Collection. Northwest Museum of Arts and Culture, Spokane, WA.","","Image;StillImage","image/jpeg","eng","","http://rightsstatements.org/vocab/NoC-US/1.0/","http://localhost:4000/make_believe_public/objects/thumbs/make_believe_068_th.jpg","http://localhost:4000/make_believe_public/objects/make_believe_068.jpg",/make_believe_public/items/make_believe_068.html
"New Year&#39;s Greetings","Fred C. Brisley","1892-01","Cover illustration for the Annual Illustrated Spokane Spokesman.","plates (illustrations);annuals (publications);cityscapes (representations);medallions (ornament areas)","Minneapolis, MN","44.97794162","-93.25715648","Inland Northwest Special Collections, Spokane Public Library, Spokane, WA.","","Image;StillImage","image/jpeg","eng","","http://rightsstatements.org/vocab/NoC-US/1.0/","http://localhost:4000/make_believe_public/objects/thumbs/make_believe_069_th.jpg","http://localhost:4000/make_believe_public/objects/make_believe_069.jpg",/make_believe_public/items/make_believe_069.html
"Studio Portrait with Classical Iconography","Samuel D. Owings Studio","1910","Example of studio portraiture in Spokane with unknown model.","studio portraits;guitars;pedestals;flowers (plant components);day dresses","816 Riverside Avenue, Spokane, WA","47.65851548","-117.4243232","Sutton Family Papers, ca. 1884- ca. 1910. MsSC 131. Eastern Washington State Historical Society (Northwest Museum of Arts and Culture). Spokane, WA.","","Image;StillImage","image/jpeg","eng","","http://rightsstatements.org/vocab/NoC-US/1.0/","http://localhost:4000/make_believe_public/objects/thumbs/make_believe_070_th.jpg","http://localhost:4000/make_believe_public/objects/make_believe_070.jpg",/make_believe_public/items/make_believe_070.html
"Studio Portrait with Classical Iconography, Detail","Samuel D. Owings Studio","1910","Detail of studio portraiture in Spokane highlighting horsehair mats imitating grass within a controlled studio space.","portraits;horsehair;rock carvings","816 Riverside Avenue, Spokane, WA","47.65851548","-117.4243232","Sutton Family Papers, ca. 1884- ca. 1910. MsSC 131. Eastern Washington State Historical Society (Northwest Museum of Arts and Culture). Spokane, WA.","","Image;StillImage","image/jpeg","eng","","http://rightsstatements.org/vocab/NoC-US/1.0/","http://localhost:4000/make_believe_public/objects/thumbs/make_believe_071_th.jpg","http://localhost:4000/make_believe_public/objects/make_believe_071.jpg",/make_believe_public/items/make_believe_071.html
"Marie Antoinettes","E.T. Hawk","1910","Scattered group of parade participants wearing French Noblewomen costumes on Riverside Avenue.","photographs;parades;costumes (character dress);street scenes;hats","811 W Riverside Avenue, Spokane, WA","47.6577859","-117.4244858","E.T. Hawk Photograph Collection. SPC-023-0996. Item SPC-023-0996_02_348. Eastern Washington University Archives, John F. Kennedy Memorial Library, Cheney, WA.","","Image;StillImage","image/jpeg","eng","","http://rightsstatements.org/vocab/NoC-US/1.0/","http://localhost:4000/make_believe_public/objects/thumbs/make_believe_072_th.jpg","http://localhost:4000/make_believe_public/objects/make_believe_072.jpg",/make_believe_public/items/make_believe_072.html
"Library with Classical Iconography","Hyslop and Westcot Architects","1911","Interior of residential library in an issue of the Inland Empire Architect magazine.","fireplaces;Doric columns;Ionic columns;bookshelves;armchairs","Spokane, WA","47.65849572","-117.4203818","Inland Empire Architect Collection, Eastern Washington State Historical Society, Northwest Museum of Arts and Culture, Spokane, WA.","","Image;StillImage","image/jpeg","eng","","http://rightsstatements.org/vocab/NoC-US/1.0/","http://localhost:4000/make_believe_public/objects/thumbs/make_believe_073_th.jpg","http://localhost:4000/make_believe_public/objects/make_believe_073.jpg",/make_believe_public/items/make_believe_073.html
"Green Velvet Effect Wallpaper","John W. Graham &amp; Co.","1910","Illustration from &lt;em&gt;Wall Papers; Artistic Wall Hangings&lt;/em&gt;, nod.","wallpapers;plates (illustrations);fireplaces;vases;interior design","Spokane, WA","47.65849572","-117.4203818","&lt;em&gt;Andrew T. Amos Papers&lt;/em&gt;, 1904–1911, MsSC 11, Eastern Washington State Historical Society, Northwest Museum of Arts and Culture, Spokane, WA.","","Image;StillImage","image/jpeg","eng","","http://rightsstatements.org/vocab/NoC-US/1.0/","http://localhost:4000/make_believe_public/objects/thumbs/make_believe_074_th.jpg","http://localhost:4000/make_believe_public/objects/make_believe_074.jpg",/make_believe_public/items/make_believe_074.html
"Circus Room Mural","","1935","Louis Davenport and Abraham Rutgers Van der Loeff in the &quot;Circus Room&quot;.","murals (general, decorations on wall);ladders;horses","10 S Post St, Spokane, WA 99201","47.6570422","-117.4240403","Northwest Room, Spokane Public Library, accessed January 24, 2026, https: //lange.spokanelibrary.org/items/show/2726.","","Image;StillImage","image/jpeg","eng","","http://rightsstatements.org/vocab/NoC-US/1.0/","http://localhost:4000/make_believe_public/objects/thumbs/make_believe_075_th.jpg","http://localhost:4000/make_believe_public/objects/make_believe_075.jpg",/make_believe_public/items/make_believe_075.html
